TARGET,[male_IDENT_S],[male_IDENT_P],[female_IDENT_S],[female_IDENT_P],[male_IDENT_S_char_del],[male_IDENT_P_char_del],[female_IDENT_S_char_del],[female_IDENT_P_char_del],[male_IDENT_S_space_add],[male_IDENT_P_space_add],[female_IDENT_S_space_add],[female_IDENT_P_space_add],[male_IDENT_S_leet],[male_IDENT_P_leet],[female_IDENT_S_leet],[female_IDENT_P_leet]
women,-,-,mujer,mujeres,-,-,mujr,mujres,-,-,m u j e r,m u j e r e s,-,-,muj3r,muj3res
black people,negro,negros,-,-,ngro,ngros,-,-,n e g r o,n e g r o s,-,-,n3gro,n3gros,-,-
gay people,gay,gays,-,-,gy,gys,-,-,g a y,g a y s,-,-,g4y,g4ys,-,-
trans people,trans,trans,-,-,trns,trns,-,-,t r a n s,t r a n s,-,-,tr4ns,tr4ns,-,-
indigenous people,indígena,indígenas,-,-,indgena,indgenas,-,-,i n d í g e n a,i n d í g e n a s,-,-,ind1gena,ind1genas,-,-
jews,judío,judíos,-,-,jdío,jdíos,-,-,j u d í o,j u d í o s,-,-,jud1o,jud1os,-,-
disabled people,discapacitado,discapacitados,-,-,discapcitado,discapcitados,-,-,d i s c a p a c i t a d o,d i s c a p a c i t a d o s,-,-,disc4pacitado,disc4pacitados,-,-