TARGET,[IDENT_A],[male_IDENT_S],[female_IDENT_S],[IDENT_S],[male_IDENT_P],[female_IDENT_P],[IDENT_P],[male_IDENT_P_SUB],[female_IDENT_P_SUB],[IDENT_P_SUB],[male_IDENT_S_leet],[female_IDENT_S_leet],[IDENT_S_leet],[male_IDENT_P_leet],[female_IDENT_P_leet],[IDENT_P_leet],[male_IDENT_P_SUB_leet],[female_IDENT_P_SUB_leet],[IDENT_P_SUB_leet],[male_IDENT_S_space_add],[female_IDENT_S_space_add],[IDENT_S_space_add],[male_IDENT_P_space_add],[female_IDENT_P_space_add],[IDENT_P_space_add],[male_IDENT_P_SUB_space_add],[female_IDENT_P_SUB_space_add],[IDENT_P_SUB_space_add],[male_IDENT_S_char_del],[female_IDENT_S_char_del],[IDENT_S_char_del],[male_IDENT_P_char_del],[female_IDENT_P_char_del],[IDENT_P_char_del]
women,mahila,-,aurat,aurat,-,aurato,aurato,-,auratein,auratein,-,aur4t,aur4t,-,aur4to,aur4to,-,aur4tein,aur4tein,-,a u r a t,a u r a t,-,a u r a t o ,a u r a t o,-,a u r a t e i n,a u r a t e i n,-,aurt,aurt,-,aurat,aurat
trans people,hijri,hijra,-,hijra,hijro,-,hijro,hijre,-,hijre,h!jra,-,h!jra,h!jro,-,h!jro,h!jre,-,h!jre,h i j r a,-,h i j r a,h i j r o,-,h i j r o,h i j r e,-,h i j r e,hira,-,hira,hiro,-,hiro
gay people,gay,gay,-,gay,gays,-,gays,gays,-,gays,g4y,-,g4y,g4ys,-,g4ys,g4ys,-,g4ys,g a y,-,g a y,g a y s,-,g a y s,g a y s,-,g a y s,gy,-,gy,gay,-,gay
North-East Indians,assamese,assamese,-,assamese,assamese,-,assamese,assamese,-,assamese,a$samese,-,a$samese,a$samese,-,a$samese,a$samese,-,a$samese,a s s a m e s e,-,a s s a m e s e,a s s a m e s e ,-,a s s a m e s e ,a s s a m e s e,-,a s s a m e s e,asamese,-,asamese,asamese,-,asamese
Muslims,musalman,musalman,-,musalman,musalmano,-,musalmano,musalman,-,musalman,mus4lman,-,mus4lman,mus4lmano,-,mus4lmano,mus4lman,-,mus4lman,m u s a l m a n,-,m u s a l m a n,m u s a l m a n o,-,m u s a l m a n o,m u s a l m a n,-,m u s a l m a n,musalmn,-,musalmn,musalmno,-,musalmno
Lower Caste,shudra,shudra,-,shudra,shudro,-,shudro,shudra,-,shudra,shudr4,-,shudr4,shudr0,-,shudr0,shudr4,-,shudr4,s h u d r a,-,s h u d r a,s h u d r o,-,s h u d r o,s h u d r a,-,s h u d r a,shdra,-,shdra,shdro,-,shdro
Black people,negro,negro,-,negro,negro,-,negro,negro,-,negro,n3gro,-,n3gro,negr0,-,negr0,n3gro,-,n3gro,n e g r o,-,n e g r o,n e g r o,-,n e g r o,n e g r o,-,n e g r o,negr,-,negr,negr,-,negr